{"$schema":"https://json-schema.org/draft/2020-12/schema","$id":"https://universalos.dev/specs/device-enablement/test-matrix-v1.json","title":"UniversalOS device enablement test matrix v1","type":"object","additionalProperties":false,"required":["schema_version","profile_id","build_id","results"],"properties":{"schema_version":{"const":1},"profile_id":{"type":"string"},"build_id":{"type":"string"},"results":{"type":"array","minItems":1,"items":{"type":"object","additionalProperties":false,"required":["area","result","evidence"],"properties":{"area":{"enum":["boot","recovery","update","rollback","display","input","storage","power","wifi","bluetooth","audio","camera","sensors","cellular"]},"result":{"enum":["working","partial","unavailable","untested","blocked","unsafe"]},"evidence":{"type":"string","minLength":1}}}}}}
