{"schema_version":1,"profile_id":"uos.profile.synthetic.orion-arm64-v1","build_id":"test-only-0.1.0","results":[{"area":"boot","result":"working","evidence":"Synthetic host fixture."},{"area":"recovery","result":"untested","evidence":"Physical proof intentionally pending."},{"area":"update","result":"untested","evidence":"QEMU/native gate pending."},{"area":"rollback","result":"untested","evidence":"QEMU/native gate pending."}]}
